variance_mixed_benchmark_metrics.csv

Model,OOD_Accuracy,OOD_F1,OOD_Precision,OOD_Recall,OOD_AUC,FPS,Params
Mixed Dataset QSVC (Legit Run 1),0.94,0.9411764705882352,0.9230769230769232,0.96,0.9856,,1024
Mixed Dataset QSVC (Legit Run 2),0.96,0.96,0.96,0.96,0.9888,,1024
Mixed Dataset QSVC (Legit Run 3),0.92,0.92,0.92,0.92,0.968,,1024
Mixed Dataset QSVC (Legit Run 4),0.94,0.9361702127659576,1.0,0.88,0.9968,,1024
Mixed Dataset QSVC (Legit Run 5),0.88,0.8846153846153846,0.8518518518518519,0.92,0.9568,,1024
Mixed Dataset QSVC (Legit Run 6),0.96,0.9583333333333334,1.0,0.92,0.9776,,1024
Mixed Dataset QSVC (Legit Run 7),0.96,0.9615384615384616,0.925925925925926,1.0,0.9888,,1024
Mixed Dataset QSVC (Legit Run 8),0.9,0.9019607843137256,0.8846153846153846,0.92,0.9744,,1024
Mixed Dataset QSVC (Legit Run 9),0.96,0.9615384615384616,0.925925925925926,1.0,0.9984,,1024
Mixed Dataset QSVC (Legit Run 10),0.9,0.9056603773584906,0.8571428571428571,0.96,0.9792,,1024

outputs.md

Epoch    GPU_mem       loss  Instances       Size
       4/15      2.61G    0.07513         25        128: 100% ━━━━━━━━━━━━ 75/75 5.5it/s 13.6s
               classes   top1_acc   top5_acc: 100% ━━━━━━━━━━━━ 32/32 4.6it/s 6.9s
                   all      0.998          1

--- QSVC FINAL METRICS ---
  --> Acc: 0.9600 | Prec: 1.0000 | Rec: 0.9231 | F1: 0.9600 | AUC: 0.9984
Saved results to final_benchmark_metrics.csv
PS C:\Tools\Quantum_Classification>
'''

--- QSVC FINAL METRICS (Run 2) ---
  --> Acc: 0.9400 | Prec: 0.9231 | Rec: 0.9600 | F1: 0.9412 | AUC: 0.9872
Saved results for Run 2 to final_benchmark_metrics.csv

--- QSVC FINAL METRICS (Run 3) ---
  --> Acc: 0.9200 | Prec: 0.9200 | Rec: 0.9200 | F1: 0.9200 | AUC: 0.9888
Saved results for Run 3 to final_benchmark_metrics.csv

--- QSVC FINAL METRICS (Run 6) ---
  --> Acc: 0.9000 | Prec: 0.8846 | Rec: 0.9200 | F1: 0.9020 | AUC: 0.9520
Saved results for Run 6 to final_benchmark_metrics.csv

--- QSVC FINAL METRICS (Run 1) ---
  --> Acc: 0.9400 | Prec: 0.9231 | Rec: 0.9600 | F1: 0.9412 | AUC: 0.9856
Saved results for Run 1 to variance_mixed_benchmark_metrics.csv

--- QSVC FINAL METRICS (Run 2) ---
  --> Acc: 0.9600 | Prec: 0.9600 | Rec: 0.9600 | F1: 0.9600 | AUC: 0.9888
Saved results for Run 2 to variance_mixed_benchmark_metrics.csv

--- QSVC FINAL METRICS (Run 4) ---
  --> Acc: 0.9400 | Prec: 1.0000 | Rec: 0.8800 | F1: 0.9362 | AUC: 0.9968
Saved results for Run 4 to variance_mixed_benchmark_metrics.csv

--- QSVC FINAL METRICS (Run 5) ---
  --> Acc: 0.8800 | Prec: 0.8519 | Rec: 0.9200 | F1: 0.8846 | AUC: 0.9568
Saved results for Run 5 to variance_mixed_benchmark_metrics.csv

--- QSVC FINAL METRICS (Run 6) ---
  --> Acc: 0.9600 | Prec: 1.0000 | Rec: 0.9200 | F1: 0.9583 | AUC: 0.9776
Saved results for Run 6 to variance_mixed_benchmark_metrics.csv

--- QSVC FINAL METRICS (Run 7) ---
  --> Acc: 0.9600 | Prec: 0.9259 | Rec: 1.0000 | F1: 0.9615 | AUC: 0.9888
Saved results for Run 7 to variance_mixed_benchmark_metrics.csv

--- QSVC FINAL METRICS (Run 8) ---
  --> Acc: 0.9000 | Prec: 0.8846 | Rec: 0.9200 | F1: 0.9020 | AUC: 0.9744
Saved results for Run 8 to variance_mixed_benchmark_metrics.csv

--- QSVC FINAL METRICS (Run 9) ---
  --> Acc: 0.9600 | Prec: 0.9259 | Rec: 1.0000 | F1: 0.9615 | AUC: 0.9984
Saved results for Run 9 to variance_mixed_benchmark_metrics.csv

--- QSVC FINAL METRICS (Run 10) ---
  --> Acc: 0.9000 | Prec: 0.8571 | Rec: 0.9600 | F1: 0.9057 | AUC: 0.9792
Saved results for Run 10 to variance_mixed_benchmark_metrics.csv